{
    "name": "ninja",
    "version": "latest",
    "download": {
        "type": "git",
        "url": "https://github.com/ninja-build/ninja.git"
    },
    "patch": {
        "files": [
            "ninja.patch"
        ]
    },
    "buildSystem": {
        "type": "cmake",
        "configure": {},
        "build": {},
        "install": {}
    }
}
