{
    "name": "curl",
    "version": "7.71.1",
    "download": {
        "type": "tarball",
        "url": "https://curl.se/download/curl-7.71.1.tar.gz",
        "kind": "gz",
        "signature": "https://curl.se/download/curl-7.71.1.tar.gz.asc",
        "sourceDirectory": "curl-7.71.1"
    },
    "patch": {
        "files": [
            "curl-7.71.1.patch"
        ]
    },
    "buildSystem": {
        "type": "autoconf",
        "configure": {
            "env": {
                "curl_disallow_getaddrinfo": "yes"
            },
            "settings": {
                "--with-shared": true,
                "--disable-ipv6": true
            }
        },
        "build": {},
        "install": {}
    }
}
